[
 {
  "id": "ccx-001",
  "kind": "contain-crosswalk",
  "spec_clause": "CLC §13.8/§9.3",
  "profile": "aic-jwt-da->clc-v1",
  "parent_source": {
   "capabilities": [
    {
     "id": "std/database-v1:query:*",
     "params": {
      "limit": 100
     }
    }
   ]
  },
  "child_source": {
   "capabilities": [
    {
     "id": "std/database-v1:query:SELECT",
     "params": {
      "limit": 50
     }
    }
   ]
  },
  "expect": {
   "contains": true
  },
  "derivation": "AIC-JWT DA principal boundary (wildcard, limit<=100) contains the sub-agent capability (literal, limit<=50)"
 },
 {
  "id": "ccx-002",
  "kind": "contain-crosswalk",
  "spec_clause": "CLC §13.4.3",
  "profile": "aic-jwt-da->clc-v1",
  "parent_source": {
   "capabilities": [
    {
     "id": "std/database-v1:query:SELECT",
     "params": {
      "limit": 100
     }
    }
   ]
  },
  "child_source": {
   "capabilities": [
    {
     "id": "std/database-v1:query:SELECT",
     "params": {
      "limit": 150
     }
    }
   ]
  },
  "expect": {
   "contains": false,
   "reason": "params_not_narrower"
  },
  "derivation": "sub-agent asks a wider bound than the principal declared"
 },
 {
  "id": "ccx-003",
  "kind": "contain-crosswalk",
  "spec_clause": "CLC §13.4.2",
  "profile": "aic-jwt-da->clc-v1",
  "parent_source": {
   "capabilities": [
    {
     "id": "std/database-v1:query:SELECT"
    }
   ]
  },
  "child_source": {
   "capabilities": [
    {
     "id": "std/database-v1:query:INSERT"
    }
   ]
  },
  "expect": {
   "contains": false,
   "reason": "child_exceeds_parent"
  },
  "derivation": "sub-agent requests an action the principal did not grant"
 },
 {
  "id": "ccx-004",
  "kind": "contain-crosswalk",
  "spec_clause": "CLC §13.4.3",
  "profile": "aic-jwt-da->clc-v1",
  "parent_source": {
   "capabilities": [
    {
     "id": "std/database-v1:query:SELECT",
     "params": {
      "limit": 100
     }
    }
   ]
  },
  "child_source": {
   "capabilities": [
    {
     "id": "std/database-v1:query:SELECT"
    }
   ]
  },
  "expect": {
   "contains": false,
   "reason": "params_not_narrower"
  },
  "derivation": "sub-agent drops the principal's bound (unconstrained under a bounded boundary)"
 },
 {
  "id": "ccx-005",
  "kind": "contain-crosswalk",
  "spec_clause": "CLC §13.4.3",
  "profile": "aic-jwt-da->clc-v1",
  "parent_source": {
   "capabilities": [
    {
     "id": "std/database-v1:query:SELECT",
     "params": {}
    }
   ]
  },
  "child_source": {
   "capabilities": [
    {
     "id": "std/database-v1:query:SELECT",
     "params": {
      "limit": 50
     }
    }
   ]
  },
  "expect": {
   "contains": true
  },
  "derivation": "an empty params object is unconstrained (CLC-A rev CLC-1.3), so it contains any sub-agent bound"
 },
 {
  "id": "ccx-006",
  "kind": "contain-crosswalk",
  "spec_clause": "CLC §13.4.3",
  "profile": "oauth-rar->clc-v1",
  "parent_source": {
   "type": "std/database-v1",
   "actions": [
    "query:SELECT"
   ],
   "params": {
    "limit": 100
   }
  },
  "child_source": {
   "type": "std/database-v1",
   "actions": [
    "query:SELECT"
   ],
   "params": {
    "limit": 50
   }
  },
  "expect": {
   "contains": true
  },
  "derivation": "RAR authorization_details: the requested action is inside the granted bound"
 },
 {
  "id": "ccx-007",
  "kind": "contain-crosswalk",
  "spec_clause": "CLC §13.4.3",
  "profile": "oauth-rar->clc-v1",
  "parent_source": {
   "type": "std/database-v1",
   "actions": [
    "query:SELECT"
   ],
   "params": {
    "limit": 50
   }
  },
  "child_source": {
   "type": "std/database-v1",
   "actions": [
    "query:SELECT"
   ],
   "params": {
    "limit": 100
   }
  },
  "expect": {
   "contains": false,
   "reason": "params_not_narrower"
  },
  "derivation": "RAR request exceeds the granted bound"
 },
 {
  "id": "ccx-008",
  "kind": "contain-crosswalk",
  "spec_clause": "CLC §13.4.2",
  "profile": "ucan->clc-v1",
  "parent_source": {
   "with": "std/database-v1",
   "can": "query:*"
  },
  "child_source": {
   "with": "std/database-v1",
   "can": "query:SELECT"
  },
  "expect": {
   "contains": true
  },
  "derivation": "UCAN {with,can}: the delegated {with,can} is covered by the parent capability"
 },
 {
  "id": "ccx-009",
  "kind": "contain-crosswalk",
  "spec_clause": "CLC §13.4.2",
  "profile": "ucan->clc-v1",
  "parent_source": {
   "with": "std/database-v1",
   "can": "query:SELECT"
  },
  "child_source": {
   "with": "std/database-v1",
   "can": "query:*"
  },
  "expect": {
   "contains": false,
   "reason": "child_exceeds_parent"
  },
  "derivation": "UCAN attenuation violated: the delegated capability widens to a wildcard"
 },
 {
  "id": "ccx-010",
  "kind": "contain-crosswalk",
  "spec_clause": "CLC §13.4.3",
  "profile": "delegation-chain->clc-v1",
  "parent_source": {
   "links": [
    {
     "id": "std/database-v1:query:SELECT",
     "params": {
      "limit": 100
     }
    }
   ]
  },
  "child_source": {
   "links": [
    {
     "id": "std/database-v1:query:SELECT",
     "params": {
      "limit": 50
     }
    }
   ]
  },
  "expect": {
   "contains": true
  },
  "derivation": "a hop that tightens the declared bound stays inside the previous hop's effective grant"
 },
 {
  "id": "ccx-011",
  "kind": "contain-crosswalk",
  "spec_clause": "CLC §13.4.3",
  "profile": "delegation-chain->clc-v1",
  "parent_source": {
   "links": [
    {
     "id": "std/database-v1:query:SELECT",
     "params": {
      "limit": 50
     }
    }
   ]
  },
  "child_source": {
   "links": [
    {
     "id": "std/database-v1:query:SELECT",
     "params": {
      "limit": 100
     }
    }
   ]
  },
  "expect": {
   "contains": false,
   "reason": "params_not_narrower"
  },
  "derivation": "a hop that widens the declared bound breaks attenuation"
 },
 {
  "id": "ccx-012",
  "kind": "contain-crosswalk",
  "spec_clause": "CLC §13.4.2",
  "profile": "delegation-chain->clc-v1",
  "parent_source": {
   "links": [
    {
     "id": "std/database-v1:query:*"
    }
   ]
  },
  "child_source": {
   "links": [
    {
     "id": "std/database-v1:query:SELECT"
    }
   ]
  },
  "expect": {
   "contains": true
  },
  "derivation": "a hop that narrows a wildcard parent to a literal child stays contained"
 },
 {
  "id": "ccx-013",
  "kind": "contain-crosswalk",
  "spec_clause": "CLC §13.4.2",
  "profile": "aic-jwt-da->clc-v1",
  "parent_source": {
   "capabilities": [
    {
     "id": "std/database-v1:query:SELECT"
    }
   ]
  },
  "child_source": {
   "capabilities": [
    {
     "id": "std/crm-v1:read"
    }
   ]
  },
  "expect": {
   "contains": false,
   "reason": "different_namespace"
  },
  "derivation": "sub-agent requests a different scheme/action-class: kept as the core different_namespace"
 },
 {
  "id": "ccx-014",
  "kind": "contain-crosswalk",
  "spec_clause": "CLC §13.9.3 (ATN §5.1/§9.2)",
  "profile": "atn-manifest->clc-v1",
  "parent_source": {
   "id": "data-read",
   "action": "read",
   "bounds": {
    "max_tokens": 100000
   }
  },
  "child_source": {
   "id": "data-read",
   "action": "read",
   "bounds": {
    "max_tokens": 50000
   }
  },
  "expect": {
   "contains": true
  },
  "derivation": "ATN resource_bounds are declared ceilings; §9.2 takes the minimum of the two, so a child ceiling <= the parent's is contained"
 },
 {
  "id": "ccx-015",
  "kind": "contain-crosswalk",
  "spec_clause": "CLC §13.4.3 (ATN §9.2)",
  "profile": "atn-manifest->clc-v1",
  "parent_source": {
   "id": "data-read",
   "action": "read",
   "bounds": {
    "max_tokens": 50000
   }
  },
  "child_source": {
   "id": "data-read",
   "action": "read",
   "bounds": {
    "max_tokens": 100000
   }
  },
  "expect": {
   "contains": false,
   "reason": "params_not_narrower"
  },
  "derivation": "ATN §9.2 tightest bound wins; a child that raises the ceiling widening the declared set is not contained"
 },
 {
  "id": "ccx-016",
  "kind": "contain-crosswalk",
  "spec_clause": "CLC §13.4.2 (ATN §9.1)",
  "profile": "atn-manifest->clc-v1",
  "parent_source": {
   "id": "data-read",
   "action": "read"
  },
  "child_source": {
   "id": "data-write",
   "action": "read"
  },
  "expect": {
   "contains": false,
   "reason": "different_namespace"
  },
  "derivation": "ATN identity rule needs the same id (and schema digest); a different capability id maps to a different CLC action class"
 },
 {
  "id": "ccx-017",
  "kind": "contain-crosswalk",
  "spec_clause": "CLC §13.4.3 (ATN §5.1)",
  "profile": "atn-manifest->clc-v1",
  "parent_source": {
   "id": "data-read",
   "action": "read",
   "bounds": {
    "max_response_size_bytes": 10485760
   }
  },
  "child_source": {
   "id": "data-read",
   "action": "read"
  },
  "expect": {
   "contains": false,
   "reason": "params_not_narrower"
  },
  "derivation": "ATN conditions are optional; a child that declares no bound under a bounded parent has widened the declared set"
 },
 {
  "id": "ccx-018",
  "kind": "contain-crosswalk",
  "spec_clause": "CLC §13.4.3 (AAT §4.5 I4)",
  "profile": "aat-i4->clc-v1",
  "parent_source": {
   "tool": "query",
   "args": {
    "limit": 100
   }
  },
  "child_source": {
   "tool": "query",
   "args": {
    "limit": 50
   }
  },
  "expect": {
   "contains": true
  },
  "derivation": "AAT I4 argument subsumption: the derived numeric bound is at least as restrictive as the parent's"
 },
 {
  "id": "ccx-019",
  "kind": "contain-crosswalk",
  "spec_clause": "CLC §13.4.3 (AAT §4.5 I4)",
  "profile": "aat-i4->clc-v1",
  "parent_source": {
   "tool": "query",
   "args": {
    "limit": 50
   }
  },
  "child_source": {
   "tool": "query",
   "args": {
    "limit": 100
   }
  },
  "expect": {
   "contains": false,
   "reason": "params_not_narrower"
  },
  "derivation": "AAT I4 range subsumption requires derived max <= parent max; a larger bound is rejected"
 },
 {
  "id": "ccx-020",
  "kind": "contain-crosswalk",
  "spec_clause": "CLC §13.4.3 (AAT §4.5 I4)",
  "profile": "aat-i4->clc-v1",
  "parent_source": {
   "tool": "query",
   "args": {
    "limit": 100
   }
  },